publisher,grade,unit,word,part_of_speech,translation,sentence_example
翰林,七下,lesson 1,a lot of,adj.; pron.,很多的（= lots of）,Grandma cooks a lot of food for us on Thanksgiving every year.
翰林,七下,lesson 1,stand out,,突出,The black picture on the orange wall really stands out.
翰林,七下,lesson 1,different,adj.,不同的,Vincent is very different from his brother.
翰林,七下,lesson 1,top,adj.,頂尖的,My brothers both go to top schools.
翰林,七下,lesson 1,on the other hand,,另一方面,"Adam is very good at basketball. On the other hand, he's new to baseball."
翰林,七下,lesson 1,make up for,,彌補…,"For a baseball player, he's not very strong, but he makes up for it with a lot of practice."
翰林,七下,lesson 2,early,adj.; adv.,早的,A: I go to bed at ten. B: That's early.
翰林,七下,lesson 2,work,n.; v.,工作,They work eight hours a day.
翰林,七下,lesson 2,often,adv.,經常,Timothy is often quiet in class.
翰林,七下,lesson 2,get up,,起床,I'm not a morning person. I never get up before  a.m.
翰林,七下,lesson 2,usually,adv.,通常,We usually have dinner at six.
翰林,七下,lesson 2,seldom,adv.,很少,I seldom see my cousin. He is studying in Poland.
翰林,七下,lesson 2,sometimes,adv.,有時候,"A: Do you eat out? B: Yeah, sometimes."
翰林,七下,lesson 2,even,adv.,甚至,A: Do you like Alice? B: Alice? I don't even know her.
翰林,七下,lesson 2,late,adj.; adv.,晚的,"A: The movie is at  p.m. B: Wow, that's late."
翰林,七下,lesson 2,do one's homework,,做功課,My brothers do their homework in the living room.
翰林,七下,lesson 2,hour,n.,小時,That video is an hour and twenty minutes long.
翰林,七下,lesson 2,always,adv.,總是,Hank is always nervous in front of girls.
翰林,七下,lesson 2,tired,adj.,疲累的,The fans are tired after the meet-and-greet.
翰林,七下,lesson 2,shower,n.; v.,淋浴,Ashley is in the shower.
翰林,七下,lesson 2,never,adv.,從未,John is never late for school.
翰林,七下,lesson 2,by the way,,順帶一提,"By the way, is your sister at home?"
翰林,七下,lesson 2,library,n.,圖書館,Do you often go to the library?
翰林,七下,lesson 2,check out,,借（ 書 ）,I check out books from the library once a month.
翰林,七下,lesson 2,once,adv.,一次,I clean my room once a week.
翰林,七下,lesson 2,twice,adv.,兩次,They walk the dogs twice a day.
翰林,七下,lesson 2,walk,v.,遛（ 寵物 ）,We don't walk our dogs every day.
翰林,七下,lesson 2,I can't help it.,,我沒辦法。 ／我控制不了。,A: You're listening to that song again. B: I can't help it. It's so good.
翰林,七下,lesson 2,then,adv.,然後,"Wash your hands, and then you can eat."
翰林,七下,lesson 2,too,adv.,太…,The table is too small for five people.
翰林,七下,lesson 2,How often...?,,多常…？,"A: How often do you say ""I love you"" to your family? B: Not very often."
翰林,七下,lesson 2,about,adv.,大約,A: How often do you clean up your room? B: About once a month.
翰林,七下,lesson 2,brush one's teeth,,刷牙（ teeth 為 tooth 的 複數 ）,Do you brush your teeth after lunch?
翰林,七下,lesson 2,face,n.,臉,The girl's face is cute.
翰林,七下,lesson 2,breakfast,n.,早餐,Some people don't eat breakfast.
翰林,七下,lesson 2,lunch,n.,午餐,The Chen family goes out for lunch on Sundays.
翰林,七下,lesson 2,exercise,v.; n.,運動,They often exercise at the park after dinner.
翰林,七下,lesson 2,computer,n.,電腦,Students can't use the computer in class.
翰林,七下,lesson 2,minute,n.,分鐘,A: Can we go in now? B: Please wait a minute. The classroom is not ready.
翰林,七下,lesson 2,answer,n.; v.,回答；答案,A: Do you know the answer to this question? B: Sure.
翰林,七下,lesson 2,question,n.,問題,Sherry has a question about her homework.
翰林,七下,lesson 2,trouble,n.,困難；麻煩,Mr. Chen's sons often make trouble at school.
翰林,七下,lesson 2,life,n.,生活；生命,I have great friends and family. My life is good.
翰林,七下,lesson 2,love,v.; n.,愛,"We have three dogs, and we love them very much."
翰林,七下,lesson 2,real,adj.,真實的,Ross Lee is not the writer's real name.
翰林,七下,lesson 3,painting,n.,畫作,The paintings on the wall are beautiful.
翰林,七下,lesson 3,flower,n.,花,Do we have enough flowers for our dinner party?
翰林,七下,lesson 3,which,pron.; adj.,哪一個,A: Which is Kyle's house? B: The red house over there is.
翰林,七下,lesson 3,thirsty,adj.,口渴的,I am always hot and thirsty after baseball games.
翰林,七下,lesson 3,coffee,n.,咖啡,Too much coffee is not good for you.
翰林,七下,lesson 3,shop,n.,商店,There aren't many shops near my house.
翰林,七下,lesson 3,later,adv.,稍後；晚點,A: I'm going home now. Bye. B: See you later.
翰林,七下,lesson 3,Of course.,,當然。,A: Are you going to Ed's birthday party later? B: Of course.
翰林,七下,lesson 3,clerk,n.,店員,The clerk is very nice. She helps me a lot.
翰林,七下,lesson 3,may,aux.,可以；可能,A: May I come in? B: Sure. Please come in.
翰林,七下,lesson 3,juice,n.,果汁,I always have orange juice for breakfast.
翰林,七下,lesson 3,want,v.,想要,"Mr. Chen wants a baby, but Mrs. Chen doesn't."
翰林,七下,lesson 3,anything,pron.,任何事物,Do you know anything about Van Gogh?
翰林,七下,lesson 3,else,adv.,其他,"Joanne is not happy, but everyone else is."
翰林,七下,lesson 3,treat,n.; v.,請客；款待,Let me treat you to dinner later.
翰林,七下,lesson 3,sweet,adj.,甜美的；甜的,Holly is a sweet girl. People love her.
翰林,七下,lesson 3,hot,adj.,熱的,It's so hot. I want some ice cream.
翰林,七下,lesson 3,chocolate,n.,巧克力,Chocolate ice cream is my favorite.
翰林,七下,lesson 3,dollar,n.,元,A: How much is that comic book? B: It's two hundred dollars.
翰林,七下,lesson 3,for here,,內用,"May I have black coffee for here, please?"
翰林,七下,lesson 3,to go,,外帶,A: Do you want your juice for here or to go? B: To go. Thanks.
翰林,七下,lesson 3,Here you are.,,給你。,"A: May I have some tea, please? B: Sure. Here you are."
翰林,七下,lesson 3,bright,adj.,鮮豔的；明亮的,The man is painting the wall bright blue.
翰林,七下,lesson 3,dark,adj.,黑的；暗的,It's too dark in my room. I can't read.
翰林,七下,lesson 3,art,n.,美術；藝術,Miss Lee is an art teacher at Green Junior High School.
翰林,七下,lesson 3,milk,n.,牛奶,Have some hot milk before bed.
翰林,七下,lesson 3,hamburger,n.,漢堡（= burger）,The hamburger house on Elm Street is great.
翰林,七下,lesson 3,chicken rice,n.,雞肉飯,My mom makes good chicken rice.
翰林,七下,lesson 3,tea,n.,茶,Do you have some ice? My tea is too hot.
翰林,七下,lesson 3,ice cream,n.,冰淇淋,Lara's favorite food is ice cream.
翰林,七下,lesson 3,soup,n.,湯,"In English, we always say ""eat soup,"" not ""drink soup."""
翰林,七下,lesson 3,sandwich,n.,三明治,That shop has really good sandwiches.
翰林,七下,lesson 3,work,n.,作品,The Mona Lisa is a work by Leonardo da Vinci.
翰林,七下,lesson 3,show,v.,表現；秀出,She's showing her new watch to her friends.
翰林,七下,lesson 3,part,n.,部分,Music is an important part in a movie.
翰林,七下,lesson 3,sky,n.,天空,The sky is gray today.
翰林,七下,lesson 3,street,n.,街道,It's a quiet night. There are no people on the street.
翰林,七下,lesson 3,by,prep.,被；由,I'm reading some books by Charles Dickens.
翰林,七下,lesson 4,why,adv.,為什麼,Why is the sea blue?
翰林,七下,lesson 4,wear,v.,戴；穿,I never wear a watch.
翰林,七下,lesson 4,mask,n.,口罩；面具,Dr. Smith is wearing a mask.
翰林,七下,lesson 4,because,conj.,因為,I drink coffee in the morning because it wakes me up.
翰林,七下,lesson 4,sick,adj.,生病的,Mindy can't come to the party because she's sick.
翰林,七下,lesson 4,water,n.,水,"A: How may I help you? B: Can I have some water, please?"
翰林,七下,lesson 4,glass,n.,玻璃杯；玻璃,A: What is that? B: That's a glass of milk shake.
翰林,七下,lesson 4,flour,n.,麵粉,There are three bags of flour on the table.
翰林,七下,lesson 4,need,v.; n.,需要；需求,A: How many apples do you need? B: Six is enough. Thanks.
翰林,七下,lesson 4,pie,n.,派,Do you want some apple pie?
翰林,七下,lesson 4,still,adv.,仍然,The boy is still hungry after the big meal.
翰林,七下,lesson 4,thing,n.,東西；事情,Can you buy these things for me?
翰林,七下,lesson 4,a little,,一點點,"A: Do you have any milk? I only need a little. B: No, I don't have any."
翰林,七下,lesson 4,salt,n.,鹽,Do not eat too much salt. It is not good for you.
翰林,七下,lesson 4,something,pron.,某物；某事,I have something for you.
翰林,七下,lesson 4,sugar,n.,糖,A: How much is a bag of sugar? B: It's NT$.
翰林,七下,lesson 4,get,v.,取得,We can get some food over there.
翰林,七下,lesson 4,all right,,好的；好吧,A: I don't have any eggs. Can you give me some? B: All right. Here you go.
翰林,七下,lesson 4,so,conj.,所以,"Marvin is always tired in the morning, so he sometimes takes a shower before work."
翰林,七下,lesson 4,back off,,退後；走開,Back off! Don't play with the dog. It's not safe.
翰林,七下,lesson 4,meal,n.,餐,My family always has a big meal on Christmas Eve.
翰林,七下,lesson 4,bottle,n.,瓶子,There is a bottle of juice on the sofa.
翰林,七下,lesson 4,candy,n.,糖果,Is there any candy in the box?
翰林,七下,lesson 4,popcorn,n.,爆米花,A tub of popcorn is NT$.
翰林,七下,lesson 4,cup,n.,杯,A: I am so tired. B: A cup of coffee can help.
翰林,七下,lesson 4,bowl,n.,碗,She eats a bowl of fruit every morning.
翰林,七下,lesson 4,fruit salad,n.,水果沙拉,How about a plate of fruit salad for breakfast?
翰林,七下,lesson 4,pizza,n.,披薩,These five pizzas are for Andy's party.
翰林,七下,lesson 4,milk shake（= milkshake）,n.,奶昔,I'm making some milk shake. Do you want some?
翰林,七下,lesson 4,can,n.,罐子,The can of juice is bad. Don't drink it.
翰林,七下,lesson 4,toast,n.; v.,烤吐司；烘烤,Miss Parker often has toast for breakfast.
翰林,七下,lesson 4,bread,n.,麵包,Do you like white bread or brown bread?
翰林,七下,lesson 4,yummy,adj.,好吃的,These cookies are yummy. Where can I get them?
翰林,七下,lesson 4,easy,adj.,容易的,Life is not easy for many people.
翰林,七下,lesson 4,snack,n.,點心,I'm hungry. I want some snacks.
翰林,七下,lesson 4,kid,n.,小孩,"A: Is this your kid? He's cute. B: Yes, he is my son."
翰林,七下,lesson 4,cheese,n.,乳酪,Kyle always puts a lot of cheese on his pizza.
翰林,七下,lesson 4,plate,n.,盤子,Please be careful. This is my mom's favorite plate.
翰林,七下,lesson 4,last,adv.; adj.,最後（的）,"This is our last bottle of water, guys."
翰林,七下,lesson 4,enjoy,v.,享受；喜愛,A: Don't be nervous. Enjoy your time! B: Thanks.
翰林,七下,lesson 4,turn into,,（使）變成,We can turn this sofa into a bed.
翰林,七下,lesson 4,each,adj.; pron.,每一個（的）,Each family is enjoying the holidays.
翰林,七下,lesson 5,yesterday,adv.; n.,昨天,I didn't go to school yesterday.
翰林,七下,lesson 5,beach,n.,海灘,My wife and I take a walk on the beach every morning.
翰林,七下,lesson 5,trash,n.,垃圾,A: How much are the trash bags? B: One hundred dollars.
翰林,七下,lesson 5,ago,adv.,前；以前,I watched the movie at home two days ago.
翰林,七下,lesson 5,visit,v.; n.,拜訪,A: How often do you visit your grandmother? B: Once a week.
翰林,七下,lesson 5,island,n.,島嶼,The island is small but very beautiful.
翰林,七下,lesson 5,a few,,幾個；一些,Only a few people like this painting.
翰林,七下,lesson 5,sea,n.,海,The dark blue sea is so beautiful.
翰林,七下,lesson 5,stop,v.,停止,"A: The guy stopped and looked at you. Do you know him? B: No, I don't."
翰林,七下,lesson 5,happen,v.,發生,A: Henry is not happy. What happened to him? B: I don't know.
翰林,七下,lesson 5,dead,adj.,死亡的,"Her dog was dead, and she was very sad."
翰林,七下,lesson 5,warm,adj.,溫暖的,"A: Can I have some warm water, please? B: Sure."
翰林,七下,lesson 5,rainforest（= rain forest）,n.,雨林,There are many plants and animals in the rainforest.
翰林,七下,lesson 5,die（ 現在分詞為dying ）,v.,死亡,A: My dog died yesterday. B: I'm sorry.
翰林,七下,lesson 5,by,prep.,在…旁邊,There is a brown horse by the big tree.
翰林,七下,lesson 5,How come?,,怎麼會？／為什麼？,A: I don't like Ted. B: How come? He is a nice guy.
翰林,七下,lesson 5,then,adv.,那時候,I worked in that company then.
翰林,七下,lesson 5,busy,adj.,忙碌的,Parents are always busy.
翰林,七下,lesson 5,river,n.,河流,Do not swim in the river.
翰林,七下,lesson 5,lake,n.,湖泊,There are many beautiful fish in the lake.
翰林,七下,lesson 5,hill,n.,山丘,My grandpa's house stands on a hill.
翰林,七下,lesson 5,mountain,n.,山,Bears live in the mountains.
翰林,七下,lesson 5,camp,n.; v.,露營；紮營,We seldom camp in the mountains in January.
翰林,七下,lesson 5,climb,v.,爬（ 山 ）,The fox climbed up the tree for food.
翰林,七下,lesson 5,row a boat,,划船,I rowed a boat with my parents on the river.
翰林,七下,lesson 5,plant,v.; n.,種植；植物,My mom planted an apple tree for me.
翰林,七下,lesson 5,hike,v.; n.,健行,Mr. Thompson hikes in the forest every weekend.
翰林,七下,lesson 5,picnic,v.; n.,野餐,My friends and I didn't go on a picnic that day.
翰林,七下,lesson 5,last,adj.,上一個的,"Yesterday was my friend's birthday, and we had a big meal last night."
翰林,七下,lesson 5,live,v.,居住,Marie lives in a tree house with her family.
翰林,七下,lesson 5,playground,n.,遊樂場；操場,Kids often make new friends at the playground.
翰林,七下,lesson 5,everything,pron.,每樣事物,Annie really likes Toby. She knows everything about him.
翰林,七下,lesson 5,change,v.; n.,改變,Maggie changed her phone number a few days ago.
翰林,七下,lesson 5,burn,v.,燃燒,The company burned the rainforest and planted palm trees.
翰林,七下,lesson 5,oil,n.,油,"A: Go wash your hands. There's oil on them. B: OK, Dad."
翰林,七下,lesson 5,sell,v.,賣,"A: Did you sell your car? B: Yes, I needed the money."
翰林,七下,lesson 5,make money,,賺錢,Tommy makes money for his family.
翰林,七下,lesson 5,miss,v.,想念,I miss my elementary school classmates.
翰林,七下,lesson 5,little,adj.,小的,The little girl over there is Tina's sister.
翰林,七下,lesson 5,little by little,,一點一點地；逐漸地,The ice turned into water little by little.
翰林,七下,lesson 5,way,n.,方式,"Ted goes to bed before  p.m. This way, he can have enough sleep."
翰林,七下,lesson 6,airport,n.,機場,There is an airport near my house.
翰林,七下,lesson 6,travel,v.; n.,旅行；行進,Eric is traveling the world with his family.
翰林,七下,lesson 6,rest,n.; v.,休息,Why don't we take a rest under the big tree?
翰林,七下,lesson 6,hotel,n.,飯店,There are three hotels on this street.
翰林,七下,lesson 6,plane（= airplane）,n.,飛機,The workers are building an airplane.
翰林,七下,lesson 6,the sights,n.,風景；名勝,Welcome to Indonesia. Let's go see the sights!
翰林,七下,lesson 6,bookstore,n.,書店,Elly often goes to the bookstore after school.
翰林,七下,lesson 6,buy,v.,購買,My brother bought a nice pencil case at the shop.
翰林,七下,lesson 6,just,adv.,剛才；就；只,Amy just came back from the US.
翰林,七下,lesson 6,learn,v.,學習,My grandpa plays the piano. I learned a lot about music from him.
翰林,七下,lesson 6,story,n.,故事,The story about the boy was so sad.
翰林,七下,lesson 6,cool,adj.,酷的,A: Where did you get this cool watch? B: From my mom. It was for my birthday.
翰林,七下,lesson 6,train,n.,火車,Nick is now on a train to the Taj Mahal.
翰林,七下,lesson 6,cold,adj.,冷的,Your hands are so cold.
翰林,七下,lesson 6,try,v.; n.,嘗試,"Penny tried the salad, but she didn't like it."
翰林,七下,lesson 6,way,n.,距離；路線,It's a long way from my house to school.
翰林,七下,lesson 6,take,v.,帶；拿；取,I took an umbrella with me to school.
翰林,七下,lesson 6,the other day,,前幾天,I went to the beach the other day and met my friend.
翰林,七下,lesson 6,station,n.,車站；局,Wendy is on her way to the train station.
翰林,七下,lesson 6,department store,n.,百貨公司,Many people go to the department store on weekends.
翰林,七下,lesson 6,restaurant,n.,餐廳,Maggie likes the chicken soup at this restaurant.
翰林,七下,lesson 6,theater,n.,電影院,The movie theater sells great popcorn.
翰林,七下,lesson 6,market,n.,市場,Ellen goes to the night market every Friday night.
翰林,七下,lesson 6,temple,n.,寺廟,Sam visited many temples last month.
翰林,七下,lesson 6,famous,adj.,有名的,There is a famous ice cream shop next to our school.
翰林,七下,lesson 6,during,prep.,在…期間,Don't use your phone during a movie.
翰林,七下,lesson 6,besides,prep.; adv.,除…之外,"Besides a cat, we also got a dog from the farm."
翰林,七下,lesson 6,fall in love,,墜入情網,He fell in love at age sixteen.
翰林,七下,lesson 6,age,n.,年紀,The king died at a young age.
翰林,七下,lesson 6,lose,v.,失去,I lost my water bottle at the beach yesterday.
翰林,七下,lesson 6,cry,v.,哭泣,A: I'm so sad now. B: Just cry. It can help.
翰林,七下,lesson 6,hide,v.,躲藏,"I hid behind the tree, so my mom couldn't see me."
翰林,七下,lesson 6,build,v.,建造,My brother built a tree house during the weekend.
翰林,七下,lesson 6,trip,n.,旅行；行程,Jim really enjoyed his trip to the US last year.
翰林,七下,lesson 6,sadly,adv.,令人傷心地,"Sadly, Mrs. Ko's son lost his life at a young age."
翰林,七下,lesson 6,last,v.,持續,A: How long did the concert last? B: Two hours. The fans enjoyed it very much.
翰林,八上,lesson 1,summer vacation,n.,暑假,I went to Australia during summer vacation in August.
翰林,八上,lesson 1,weather,n.,天氣,The weather in Africa is usually hot.
翰林,八上,lesson 1,Taiwan,n.,臺灣,Taiwan is an island with a lot of yummy food.
翰林,八上,lesson 1,fun,n.; adj.,樂趣；有趣的,A: Was it fun at the park last Sunday? B: No. It was rainy all day.
翰林,八上,lesson 1,cold,adj.,冷的,A: How is the weather today? B: It's very cold.
翰林,八上,lesson 1,snow,v.; n.,下雪；雪,"A: Does it snow in Taiwan? B: Yes, but it only snows in the mountains."
翰林,八上,lesson 1,send,v.,寄；送,Did you send your mom a Christmas card?
翰林,八上,lesson 1,postcard,n.,明信片,I sent my brother a postcard from Poland.
翰林,八上,lesson 1,lovely,adj.,可愛的；美好的,"Mark is a lovely person, so he has many friends."
翰林,八上,lesson 1,whose,pron.,誰的（東西）,Whose birthday cake is that?
翰林,八上,lesson 1,mine,pron.,我的（東西）,"A: Kevin, is that book yours? B: Yes, it's mine."
翰林,八上,lesson 1,jacket,n.,夾克,"Tyler, can I borrow your jacket, please? I am cold."
翰林,八上,lesson 1,hate,v.,討厭,I hate milk; I never drink it.
翰林,八上,lesson 1,give,v.,給予,It's Jenny's birthday today. What can I give her as a gift?
翰林,八上,lesson 1,heavy,adj.,厚重的；大量的,We had heavy snow last week.
翰林,八上,lesson 1,kind,adj.,親切的；有同情心的,Michelle is a kind teacher. Her students like her very much.
翰林,八上,lesson 1,season,n.,季節,Many people visit the island during the holiday season.
翰林,八上,lesson 1,sun,n.,太陽,Don't sit in the sun; it's too hot.
翰林,八上,lesson 1,wind,n.,風,The winds are so strong today.
翰林,八上,lesson 1,autumn,n.,秋天（= fall ）,Autumn is the season between summer and winter.
翰林,八上,lesson 1,winter,n.,冬天,Mom doesn't like winter because the weather is too cold for her.
翰林,八上,lesson 1,cloud,n.,雲,It's a beautiful day. There's not a cloud in the sky.
翰林,八上,lesson 1,spring,n.,春天,I like spring because the weather is warm.
翰林,八上,lesson 1,sunny,adj.,陽光普照的,It's sunny today. Let's take a walk in the park.
翰林,八上,lesson 1,snowy,adj.,有雪的；下雪的,We had a snowy winter last year.
翰林,八上,lesson 1,rainy,adj.,有雨的；下雨的,A: Oh no! It's rainy today. B: Don't you have an umbrella with you?
翰林,八上,lesson 1,cloudy,adj.,多雲的,A: Is it warm and sunny in Taipei now? B: No. It's cloudy.
翰林,八上,lesson 1,windy,adj.,風大的,It's very windy. Please go inside the house.
翰林,八上,lesson 1,cool,adj.,涼爽的,I took my dog to the beach on a cool evening.
翰林,八上,lesson 1,speak,v.,講話,Many people in Taiwan can speak English.
翰林,八上,lesson 1,mad,adj.,生氣的,"I was late for school again today, so my teacher was mad."
翰林,八上,lesson 1,in fact,,事實上,"In fact, she's sad these days because her cat died last week."
翰林,八上,lesson 1,mean,v.,意指,"A: What does the sign mean? B: It means ""We can't swim here."""
翰林,八上,lesson 1,order,v.; n.,點餐；訂購,Tim ordered a pizza and a milkshake.
翰林,八上,lesson 1,strange,adj.,奇怪的；陌生的,A: There's a strange man at the door. B: Don't open the door! Let's get some help.
翰林,八上,lesson 1,soon,adv.,很快地,"Good-bye, everybody. See you soon."
翰林,八上,lesson 1,Rd. (Road),n.,路（Road的縮寫）,"On a postcard, ""Rd."" stands for ""Road."""
翰林,八上,lesson 1,ROC (Republic of China),n.,中華民國（= Republic of China）,ROC is another name for Taiwan.
翰林,八上,lesson 2,club,n.,社團,I can practice English with my friends at the English club.
翰林,八上,lesson 2,make up one's mind,,下定決心,"A: What do you want for a snack, cookies or ice cream? B: I can't make up my mind. Can I have them both?"
翰林,八上,lesson 2,interesting,adj.,有趣的,Our English class is always fun and interesting. We enjoy it very much.
翰林,八上,lesson 2,think,v.,想；認為,A: Does Betty like chocolate ice cream? B: I think so.
翰林,八上,lesson 2,science,n.,科學,My father is a science teacher at a junior high school.
翰林,八上,lesson 2,subject,n.,學科；主題,"A: What's your favorite subject? B: English, of course."
翰林,八上,lesson 2,hear,v.,聽見,I heard many stories about the Taj Mahal when I was in India.
翰林,八上,lesson 2,same,adj.,相同的,"My cousin and I go to the same school, and we have the same math teacher."
翰林,八上,lesson 2,call,v.; n.,打電話；呼叫,Sorry. My dad is not at home. Please call back later.
翰林,八上,lesson 2,tell,v.,告訴,Rebecca told me an interesting story today.
翰林,八上,lesson 2,pull one's leg,,開玩笑,A: Let's buy this car. It's nice and beautiful. B: Are you pulling my leg? We don't have that much money. 
翰林,八上,lesson 2,poor,adj.,不佳的；貧窮的,Jason is poor at English. He needs more practice.
翰林,八上,lesson 2,end,n.; v.,結尾；結束,The K-pop concert ended at  p.m.
翰林,八上,lesson 2,camera,n.,相機,I can take a picture of you with my camera.
翰林,八上,lesson 2,when,conj.,當⋯,I gave John the gift when I saw him at the party yesterday.
翰林,八上,lesson 2,back,adv.,返回,My grandparents come back to Taiwan from the USA every year.
翰林,八上,lesson 2,sign up,,報名參加,Cathy signed up for the computer club.
翰林,八上,lesson 2,just,adv.,剛才,Look! I just bought a new jacket for you. Do you like it?
翰林,八上,lesson 2,wrong,adj.,錯誤的,My sister took the wrong umbrella this morning.
翰林,八上,lesson 2,hold on,,稍候,"A: This is Karen. May I speak to Danny, please? B: Sure. Hold on, please."
翰林,八上,lesson 2,math（= mathematics ）,n.,數學,Ken doesn't like math because he hates numbers.
翰林,八上,lesson 2,magic,n.; adj.,魔術；神奇的,Sally is a big fan of magic.
翰林,八上,lesson 2,soccer,n.,足球,"A: Which do you like, soccer or baseball? B: I like baseball because I'm very bad at soccer."
翰林,八上,lesson 2,Chinese,adj.; n.,中國的；中國人,We always have a big dinner on Chinese New Year's Eve.
翰林,八上,lesson 2,history,n.,歷史,India has a long and interesting history.
翰林,八上,lesson 2,violin,n.,小提琴,"A: Can you play the violin? B: Yes, and I can play the piano, too."
翰林,八上,lesson 2,robot,n.,機器人,Willy has a robot dog; he plays with it every day.
翰林,八上,lesson 2,health,n.,健康,Apples are good for your health.
翰林,八上,lesson 2,PE (physical education),n.,體育（= physical education ）,Leo likes PE class because he is good at sports.
翰林,八上,lesson 2,look for,,尋找,A: What are you looking for? B: My notebook. It was on the desk this morning.
翰林,八上,lesson 2,Ms.,n.,女士,Ms. Yang is a kind person. She sends food to the poor.
翰林,八上,lesson 2,engineer,n.,工程師,My brother is an engineer at a computer company.
翰林,八上,lesson 2,learn,v.,學習,Now I can cook because I learned a lot from my grandpa.
翰林,八上,lesson 2,lesson,n.,課；課程,I have an English lesson every Monday and Thursday.
翰林,八上,lesson 2,difficult,adj.,困難的,I cannot do my math homework; it is too difficult for me.
翰林,八上,lesson 2,teach,v.,教導,Mr. Bill is a teacher. He teaches science at my school.
翰林,八上,lesson 2,own,adj.; v.,自己的；擁有,Joe owns a really nice bicycle.
翰林,八上,lesson 2,finish,v.,完成；結束,A: What time does the basketball game finish? B: At  p.m.
翰林,八上,lesson 2,festival,n.,節慶,There is a K-pop festival in spring.
翰林,八上,lesson 2,start,v.; n.,開始,Our summer vacation starts in late June.
