publisher,grade,unit,word,part_of_speech,translation,sentence_example
康軒,八上,lesson 6,truck,n.,卡車,
康軒,八上,lesson 6,ship,n.,船；艦,
康軒,八上,lesson 6,boat,n.,小船,
康軒,八上,lesson 6,drive / drove,v.,駕駛（車）,
康軒,八上,lesson 6,row,v.,划（船）,
康軒,八上,lesson 6,north,n.; adj.; adv.,北方（的）；朝北,
康軒,八上,lesson 6,west,n.; adj.; adv.,西方（的）；朝西,
康軒,八上,lesson 6,east,n.; adj.; adv.,東方（的）；朝東,
康軒,八上,lesson 6,south,n.; adj.; adv.,南方（的）；朝南,
康軒,八上,lesson 6,Excuse me.,-,不好意思。,
康軒,八上,lesson 6,sir,n.,先生,
康軒,八上,lesson 6,wrong,adj.,錯誤的,
康軒,八上,lesson 6,forget / forgot,v.,忘記,
康軒,八上,lesson 6,outside,prep.; adv.,在……外面；在室外,
康軒,八上,lesson 6,on foot,-,走路；步行,
康軒,八上,lesson 6,turn right,-,右轉,
康軒,八上,lesson 6,corner,n.,轉角,
康軒,八上,lesson 6,straight,adv.; adj.,直地；直的,
康軒,八上,lesson 6,block,n.,街區,
康軒,八上,lesson 6,left,n.; adj.; adv.,左邊（的）；向左地,
康軒,八上,lesson 6,across from,,在……對面,
康軒,八上,lesson 6,smartphone,n.,智慧型手機,
康軒,八上,lesson 6,cost / cost,v.,花費（金錢）,
康軒,八上,lesson 6,thousand,n. ,千,
康軒,八上,lesson 6,shake / shook hands,,握手,
康軒,八上,lesson 6,pocket,n.,口袋,
康軒,八上,lesson 6,monster,n.,怪獸,
康軒,八上,lesson 6,clerk,n.,店員,
康軒,八上,lesson 6,convenient,adj.,方便的,
康軒,八上,lesson 6,mistake,n.,錯誤,
康軒,八上,lesson 6,cheap,adj.,便宜的,
康軒,八上,lesson 6,expensive,adj.,昂貴的,
康軒,八上,lesson 6,pay / paid,v.,付錢,
康軒,八上,lesson 6,beef,n.,牛肉,
康軒,八上,lesson 6,parking space,n.,停車位,
康軒,八下,lesson 1,on sale,,特價,"The clothes in this shop are on sale, so they’re cheaper now."
康軒,八下,lesson 1,sell / sold,v.,販售,"I sold my bike to Jamie for NT$,."
康軒,八下,lesson 1,price,n.,價格；價,Bill sold his house at a high price.
康軒,八下,lesson 1,cap,n.,（有帽舌的）帽子,The man in the black cap is Tina’s uncle.
康軒,八下,lesson 1,jeans,n.,牛仔褲,Nick spent three thousand dollars on this pair of jeans.
康軒,八下,lesson 1,jacket,n.,夾克,It’s cold outside. Put on your jacket.
康軒,八下,lesson 1,skirt,n.,裙子,"This skirt comes in three colors: red, black, and brown."
康軒,八下,lesson 1,shorts,n.,短褲,Larry usually wears shorts in the summer.
康軒,八下,lesson 1,shirt,n.,襯衫,Mathew is wearing a blue shirt to work.
康軒,八下,lesson 1,dress,n.,洋裝,Amy bought a fashionable dress for her birthday party.
康軒,八下,lesson 1,a pair of,,一件（褲子）；一雙（鞋）,I bought this pair of pants on the Internet last week.
康軒,八下,lesson 1,pants,n.,長褲,"These pants were too long for me, so I didn’t buy them."
康軒,八下,lesson 1,wear / wore,v.,穿,She wore a pair of jeans to the party.
康軒,八下,lesson 1,try on,,試穿,This jacket is too big. Can I try on a smaller one?
康軒,八下,lesson 1,take / took off,,脫下,Please take off your hat when you are in the building.
康軒,八下,lesson 1,be full of,,充滿,"This restaurant is really popular, so it’s always full of people."
康軒,八下,lesson 1,fashionable,adj. ,流行的；時尚的,Your jeans are so fashionable. Where did you get them?
康軒,八下,lesson 1,as... as...,,如同⋯⋯一樣地⋯⋯,Exercise is as important as a good night’s sleep.
康軒,八下,lesson 1,light,adj.,輕薄的,This jacket is really light and comfortable. I’ll take it.
康軒,八下,lesson 1,than,prep.,比；比較,Your bag is heavier than mine. What did you put in it?
康軒,八下,lesson 1,already,adv.,已經,"Mia wants to buy more shoes, but she already has  pairs."
康軒,八下,lesson 1,style,n.,風格；款式,Short skirts are back in style this season.
康軒,八下,lesson 1,fashion,n.,流行；時尚,Short hair is in fashion for girls now.
康軒,八下,lesson 1,fan,n. ,狂熱愛好者；迷,Hank is a fan of the Harry Potter movies.
康軒,八下,lesson 1,fast,adj.; adv.,快速的；很快地,My brother is a fast runner.
康軒,八下,lesson 1,medium,n.; adj.,中等尺寸；中等的,Ann: What size do you wear? Ben: I wear a medium.
康軒,八下,lesson 1,large,n.; adj.,大尺寸；（尺寸、數量等）大的,"The shirt comes in three sizes, small, medium, and large."
康軒,八下,lesson 1,fitting room,n.,試衣間,Paul is trying on the jeans in the fitting room.
康軒,八下,lesson 1,agree,v.,同意,Jay: Eric is kind and always helps others. Ed: I agree. He is a nice person.
康軒,八下,lesson 1,comfortable,adj.,舒服的,I am not comfortable in these shoes. They are too small.
康軒,八下,lesson 1,fix,v.,修理；解決（問題）,Don’t worry. I can fix this machine for you.
康軒,八下,lesson 1,laundry,n.,洗衣店,Don’t wash the expensive coat at home. Take it to the laundry.
康軒,八下,lesson 1,customer,n.,顧客,The department store is having a sale. It is full of customers.
康軒,八下,lesson 1,throw / threw... away,,扔掉⋯,This old TV still works. Don’t throw it away.
康軒,八下,lesson 1,sweater,n.,毛衣,Jennifer is wearing jeans and a sweater today.
康軒,八下,lesson 1,item,n. ,項目,The restaurant has a long menu of about  items.
康軒,八下,lesson 1,page,n.,網頁；頁,Jay found the map on the page.
康軒,八下,lesson 1,grow / grew,v.,增加；成長,Sales of new cars grew by % last year.
康軒,八下,lesson 1,save,v.,省下；拯救,"Sadly, the doctors could not save the man’s life."
康軒,八下,lesson 1,nothing,pron.,沒有東西；沒有事情,"I know nothing about Ivan. In fact, he just moved here last week."
康軒,八下,lesson 1,Earth,n.,地球,There are many beautiful animals on Earth.
康軒,八下,lesson 1,planet,n.,星球,Is there life on other planets?
康軒,八下,lesson 2,candle,n.,蠟燭,Let’s light the candles in the church.
康軒,八下,lesson 2,lamp,n. ,燈,Turn on the desk lamp before you start reading.
康軒,八下,lesson 2,radio,n.,收音機,Jeremy likes to listen to the radio.
康軒,八下,lesson 2,refrigerator (fridge),n.,冰箱,We put milk in the refrigerator to stop it from going bad.
康軒,八下,lesson 2,tape recorder,n.,錄音機,People in the old days used tape recorders to record their voices.
康軒,八下,lesson 2,tape,n.,錄音帶,My parents recorded my voice on tapes when I was little.
康軒,八下,lesson 2,washing machine,n.,洗衣機,Nick put his dirty clothes in the washing machine.
康軒,八下,lesson 2,turn on,,打開（電器）,I turned on the TV to watch my favorite show.
康軒,八下,lesson 2,turn off,,關上（電器）,Remember to turn off the lamp before you leave the room.
康軒,八下,lesson 2,broken,adj.,損壞的；破碎的,The tape is broken and won’t play.
康軒,八下,lesson 2,out of order,,故障的,The toilet in the public restroom is out of order. We can’t use it now.
康軒,八下,lesson 2,fan,n.,電扇,"It was hot in the classroom, so we turned on the fans."
康軒,八下,lesson 2,apartment,n.,公寓,Jerry lives in a small apartment.
康軒,八下,lesson 2,drawer,n.,抽屜,Linda put her pencils and eraser in the desk drawer.
康軒,八下,lesson 2,strange,adj.,奇怪的；陌生的,There is a strange woman behind the house. Who is she?
康軒,八下,lesson 2,used to,,過去經常,"I used to take photos with a camera, but now I use my smartphone."
康軒,八下,lesson 2,record,v.,錄音；錄影,Push the red button to start recording.
康軒,八下,lesson 2,button,n.,按鈕,Push the blue button to turn on the fan.
康軒,八下,lesson 2,pull,v.,抽出；拉,Jeff pulled a pen out of his pocket.
康軒,八下,lesson 2,actually,adv.,實際上,"Actually, I have a test tomorrow and can’t go to the party."
康軒,八下,lesson 2,joke,v.; n.,開玩笑；笑話,"Ben: Are you serious? Amy: No, I’m joking."
康軒,八下,lesson 2,most,adv.; adj.,最；最多的,Emma is the most popular student at school.
康軒,八下,lesson 2,valuable,adj.,有價值的,These old photos are valuable to me and my family.
康軒,八下,lesson 2,push,v.,按；推,My father and I pushed the car off the road.
康軒,八下,lesson 2,anymore,adv.,再也（不⋯⋯）,Sam doesn’t live here anymore. He moved to Tainan last month.
康軒,八下,lesson 2,sweet,adj. ,甜蜜的；甜的,"For Debbie, being a mother is the sweetest thing in the world."
康軒,八下,lesson 2,memory,n.,回憶；記憶,Looking at these photos brings back so many memories.
康軒,八下,lesson 2,file,n.,檔案,Can you tell me the name of the file?
康軒,八下,lesson 2,useful,adj.,有用的,This book is very useful to me. I need it to do my science report.
康軒,八下,lesson 2,sound,n.,聲音,There are strange sounds in that room. You should take a look.
康軒,八下,lesson 2,take / took one’s place,,取⋯⋯,Karen is the most senior worker here. No one can take her place.
康軒,八下,lesson 2,software,n.,軟體,"There is a lot of software on your computer, so it runs slow."
康軒,八下,lesson 2,slow,adj.; adv.,緩慢的；緩慢地,Taking the bus will be too slow. Why don’t we take a taxi?
康軒,八下,lesson 2,poor,adj.,可憐的；貧窮的,The poor man lost his job last week.
康軒,八下,lesson 2,save,v.,儲存,Don’t forget to save your report before you turn off the computer.
康軒,八下,lesson 3,salad,n.,沙拉,I had some salad with my steak.
康軒,八下,lesson 3,bean soup,n.,豆子湯,My mom’s bean soup is delicious. We can’t get enough of it.
康軒,八下,lesson 3,pork,n.,豬肉,Al and his family don’t eat pork.
康軒,八下,lesson 3,cheese,n.,起司；乳酪,Blue cheese smells bad but tastes good.
康軒,八下,lesson 3,ham sandwich,n.,火腿三明治,Dan usually has a ham sandwich and milk for breakfast.
康軒,八下,lesson 3,vegetable soup,n.,蔬菜湯,I had a bowl of vegetable soup for lunch.
康軒,八下,lesson 3,French fries,n.,薯條,I would like to order some French fries without salt.
康軒,八下,lesson 3,steak,n.,牛排,Patty ordered a steak at the restaurant.
康軒,八下,lesson 3,coffee,n.,咖啡,Ken couldn’t sleep last night because he drank too much coffee.
康軒,八下,lesson 3,toast,n.,烤麵包片,Jim always puts butter on his toast.
康軒,八下,lesson 3,bun,n.,小圓麵包,Some people don’t eat the buns when they have a hamburger.
康軒,八下,lesson 3,bread,n.,麵包,Would you like some bread and butter?
康軒,八下,lesson 3,fried chicken,n.,炸雞,Fred eats fried chicken three times a week.
康軒,八下,lesson 3,hamburger (burger),n.,漢堡,The fast food restaurant is famous for its burgers.
康軒,八下,lesson 3,pizza,n. ,披薩,Ivy ate the whole pizza without sharing it with her friends.
康軒,八下,lesson 3,meat,n.,肉,"Chicken is white meat, and beef is red meat."
康軒,八下,lesson 3,sidewalk,n.,人行道,It’s not OK to ride your bike on the sidewalk.
康軒,八下,lesson 3,dark,adj.,黑暗的；深色的,It’s dark here. Could you please turn on the lamp?
康軒,八下,lesson 3,wall,n.,牆壁,William put pictures on the walls of his apartment.
康軒,八下,lesson 3,meal,n.,一餐,Gina cooks three meals for her family every day.
康軒,八下,lesson 3,oil,n.,油；石油,Maggie started to cook the chicken with some oil.
康軒,八下,lesson 3,sugar,n. ,糖,My dad always drinks coffee without sugar.
康軒,八下,lesson 3,order,v.; n.,點餐；訂購,"Excuse me. May I take your order, sir?"
康軒,八下,lesson 3,weight,n.,體重；重量,Tommy lost a lot of weight when he was sick.
康軒,八下,lesson 3,smell,v.,聞起來,The vegetable soup smells good. Who made it?
康軒,八下,lesson 3,panda,n.,熊貓,We saw two pandas in the zoo this Sunday.
康軒,八下,lesson 3,taste,v.,嘗起來,The fried rice tasted good. I couldn’t stop eating it.
康軒,八下,lesson 3,fresh,adj.,新鮮的,Would you like some fresh strawberries?
康軒,八下,lesson 3,dig / dug in,,開始吃,Let’s dig in before the food gets cold.
康軒,八下,lesson 3,soon,adv.,很快地,Gemma is going to be a mother soon.
康軒,八下,lesson 3,sound,v.,聽起來,Ian: What do you think about my plan? Lily: It sounds good.
康軒,八下,lesson 3,put on,,增加（體重）,I don’t eat a lot because I’m afraid of putting on weight.
康軒,八下,lesson 3,get,v.,變得,"Eat your soup first, or it will get cold."
康軒,八下,lesson 3,notice,v. ,注意；看到,Zack: Dad is back. Liza: I know. I noticed his car outside.
康軒,八下,lesson 3,invite,v.,邀請,Jordan invited us to his party last weekend.
康軒,八下,lesson 3,friendly,adj.,（某處）令人愉快的；（人）友善的,Everyone in the class was friendly to the new student.
康軒,八下,lesson 3,besides,adv.,此外；而且,"I don’t want to go shopping. Besides, I don’t have any money."
康軒,八下,lesson 3,become / became,v.,變成,Amy became a teacher because she loves teaching.
康軒,八下,lesson 3,probably,adv.,也許,"Helen likes the green T-shirt, so she will probably buy it."
康軒,八下,lesson 3,bite,n.; v.,一口的量；咬,Nick took a bite of the sandwich.
康軒,八下,lesson 3,stand / stood for,,表,The flowers stand for my love.
康軒,八下,lesson 3,matter,v.,有關係,"To Julie, her children matter more than anything else in the world."
康軒,八下,lesson 3,sign,n.,招牌；標誌,The sign on the wall says “Wash hands before you eat.”
康軒,八下,lesson 4,climb,v.,攀登,Henry climbed the tree to get apples.
康軒,八下,lesson 4,make / made a fire,,生火,Tim made a fire after he set up camp.
康軒,八下,lesson 4,boil,v.,煮沸,I am boiling water for the tea.
康軒,八下,lesson 4,lie / lay,v.,躺下,Max lay down and took a rest.
康軒,八下,lesson 4,grass,n.,草地；草,Steve is lying on the grass in the park.
康軒,八下,lesson 4,hang / hung out,,把（溼衣、襪等）晾在外面,Dad hung out the clothes to dry.
康軒,八下,lesson 4,wet,adj. ,溼的,Ian got wet all over after he gave his dog a bath.
康軒,八下,lesson 4,sock,n.,襪子,Lisa never wears shoes without socks.
康軒,八下,lesson 4,string,n.,細繩,The photos were hanging from a string on the wall.
康軒,八下,lesson 4,moon,n.,月亮,We can usually see a full moon during the Mid-Autumn Festival.
康軒,八下,lesson 4,count,v.,數數；計算,My brother and I smiled at the camera when my mom counted to three.
康軒,八下,lesson 4,set / set up,,搭（帳篷）；建立,It’s getting dark. Let’s set up camp quickly.
康軒,八下,lesson 4,pack,v.,打包 ,Sandy was still packing her bag when the taxi came.
康軒,八下,lesson 4,quickly,adv.,快速地,We walked quickly to catch the bus this morning.
康軒,八下,lesson 4,perfect,adj.,完美的,David had perfect weather during his vacation in Japan.
康軒,八下,lesson 4,be able to,,能夠,The young birds are able to fly now.
康軒,八下,lesson 4,well,adv.,很好地,I didn’t sleep well because I had a bad dream.
康軒,八下,lesson 4,loudly,adv.,大聲地,We laughed loudly during the whole movie.
康軒,八下,lesson 4,turn on one’s toes,,踮起腳尖旋轉,Jerry turned on his toes  times in the dance.
康軒,八下,lesson 4,gently,adv.,輕柔地,Emily closed the door gently because her child was sleeping.
康軒,八下,lesson 4,smile,v.; n.,微笑,The old lady smiled at me after I helped her.
康軒,八下,lesson 4,hop,v.,單腳跳躍,The little boy didn’t walk but hopped along the sidewalk.
康軒,八下,lesson 4,dancing queen,n.,舞后,Shelly is a dancing queen. She dances the best at school.
康軒,八下,lesson 4,hard,adv.,努力地,Tim studies hard and plays hard.
康軒,八下,lesson 4,trip,v.,絆倒,Andy ran too fast and tripped.
康軒,八下,lesson 4,diary,n.,日記,Ben keeps a diary about his school life.
康軒,八下,lesson 4,arrive,v.,抵達,Ann: What time will the train arrive in Taipei? Ben: At five.
康軒,八下,lesson 4,campsite,n.,露營地,There is a good campsite by the river.
康軒,八下,lesson 4,spell,v.,拼字,How do you spell your name?
康軒,八下,lesson 4,word,n.,字,Those words are too difficult for Mike. He’s just five.
康軒,八下,lesson 4,clap,v.; n.,拍手；鼓掌,"At the end of the show, one man began to clap, and the others joined in."
康軒,八下,lesson 4,cheer,v.,歡呼；鼓舞,People cheered and clapped when the singer arrived.
康軒,八下,lesson 4,collect,v.,收集,The little boy likes to collect toy cars. He has fifty of them now.
康軒,八下,lesson 4,leaves,n.,葉子 ,Zoe likes the colors of the autumn leaves.
康軒,八下,lesson 4,shape,n.,形狀,Jim’s birthday cake is in the shape of a bear.
康軒,八下,lesson 4,laugh,v.,笑,Ivan laughed at the end of Eva’s funny story.
康軒,八下,lesson 4,crazily,adv.,瘋狂地,Children were running crazily around the room.
康軒,八下,lesson 4,in the end,,最後,What did Rose decide to do in the end?
康軒,八下,lesson 4,starry,adj.,星光閃耀的,My dad took some beautiful pictures of the starry sky.
康軒,八下,lesson 4,come in,,獲得（名次）,Jessica came in last in the race.
康軒,八下,lesson 5,earthquake,n.,地震,No one was hurt in the earthquake this morning.
康軒,八下,lesson 5,unsafe,adj.,不安全的,The water is unsafe to drink.
康軒,八下,lesson 5,elevator,n.,電梯,"My leg hurts, so I’m going to take the elevator."
康軒,八下,lesson 5,shelf,n.,架子,Can you get the red book on the top shelf for me?
康軒,八下,lesson 5,low,adj.; adv.,低的；低地,There is a low table in the middle of the room.
康軒,八下,lesson 5,cover,v.,遮蓋；遮蔽,The boy covered his body with a blanket.
康軒,八下,lesson 5,unhappy,adj.,不快樂的,Why are you so unhappy? Is something wrong?
康軒,八下,lesson 5,hold onto,,緊緊抓住；抱牢,The boy held onto his mom’s arm when they crossed the street.
康軒,八下,lesson 5,hit / hit,v.,襲擊；打,The whole building shook when the earthquake hit.
康軒,八下,lesson 5,abroad,adv.,在國外,Helen and her family always go abroad in the summer.
康軒,八下,lesson 5,moment,n.,時刻,"My mom made me a sandwich, but I wasn’t hungry at that moment."
康軒,八下,lesson 5,hide / hid,v.,躲藏,Mary hid the photo in her desk drawer.
康軒,八下,lesson 5,go / went out,,（燈、火）熄滅,I couldn’t see anything when the lights went out.
康軒,八下,lesson 5,hear / heard,v.,聽到,I heard my dad singing in the shower last night.
康軒,八下,lesson 5,someone (somebody),pron.,某人,Can you ask someone else to help you? I’m busy now.
康軒,八下,lesson 5,scary,adj.,嚇人的,The story was scary. Tim couldn’t sleep after he heard it.
康軒,八下,lesson 5,fall / fell off,,（從⋯⋯）掉下,Doris fell off her bike and got hurt.
康軒,八下,lesson 5,cut / cut,v.,割傷；切,I cut my finger last night when I was making dinner.
康軒,八下,lesson 5,arm,n.,手臂,Daniel held his dog in his arms when he was crossing the street.
康軒,八下,lesson 5,knee,n.,膝蓋,Grace hurt her knees and can’t walk now.
康軒,八下,lesson 5,luckily,adv.,幸好；幸運地,"Luckily, no one got hurt in the fire."
康軒,八下,lesson 5,scene,n.,場景,The opening scene is in an apartment in New York City.
康軒,八下,lesson 5,leading,adj.,主要的,Jay: Who is the leading actress in this movie? Betty: Jennifer Lawrence.
康軒,八下,lesson 5,real-life,adj.,真實生活中的,"Believe it or not, this story is from real-life events."
康軒,八下,lesson 5,ever,adv.,在任何時候,That’s dangerous. Don’t ever do that again.
康軒,八下,lesson 5,light,n.,電燈,"Could you turn on the lights, please?"
康軒,八下,lesson 5,alone,adj.; adv.,單獨（的）；獨自（的）,James likes being alone in the house on weekends.
康軒,八下,lesson 5,suddenly,adv.,突然,The lights in the living room went out suddenly.
康軒,八下,lesson 5,event,n.,事件,The important event takes place every four years.
康軒,八下,lesson 5,land,n.,土地；地面,The man bought a piece of land near the river.
康軒,八下,lesson 5,make / made up,,組成,Two doctors and three nurses made up the special team.
康軒,八下,lesson 5,rub against,,摩擦,The cat rubbed against Sally’s leg.
康軒,八下,lesson 5,each other,,互相,Kelly and her husband looked at each other and smiled.
康軒,八下,lesson 5,as a result,,結果；因此,"Chris made a big mistake at work. As a result, he lost his job."
康軒,八下,lesson 5,deep,adj.,深的,Be careful. The water is very deep here.
康軒,八下,lesson 5,sea,n.,海,My family and I went swimming in the sea last weekend.
康軒,八下,lesson 5,window,n.,窗戶,Could you close the windows? I feel cold.
康軒,八下,lesson 5,dangerous,adj.,危險的,It’s dangerous for you to walk by yourself at night.
康軒,八下,lesson 5,plate,n.,板塊,"When two plates push against each other, earthquakes happen."
康軒,八下,lesson 6,plastic,adj.; n.,塑膠的；塑膠,Many people stopped using plastic straws.
康軒,八下,lesson 6,glove,n.,手套,Emily bought a pair of gloves in the department store.
康軒,八下,lesson 6,tableware,n.,餐具,The tableware is very clean.
康軒,八下,lesson 6,spoon,n.,湯匙,Adam is eating the soup with a spoon.
康軒,八下,lesson 6,knife,n.,刀子,I need a knife to cut my steak.
康軒,八下,lesson 6,fork,n.,叉子,The little boy is learning to eat with a fork.
康軒,八下,lesson 6,straw,n.,吸管,Linda drank her juice through a straw.
康軒,八下,lesson 6,chopsticks,n.,筷子,Michael can use chopsticks as well as Linda.
康軒,八下,lesson 6,seabird,n.,海鳥,Seabirds find their food in the sea.
康軒,八下,lesson 6,picnic,n.,野餐,Let’s go on a picnic in the park today.
康軒,八下,lesson 6,metal,n.,金屬,You can use a metal straw over and over again.
康軒,八下,lesson 6,bother,v.,費心,"Leo: Do you need me to wait for you? Ally: No, don’t bother."
康軒,八下,lesson 6,end up,,最後成為,"We planned to just have drinks, but we ended up having a meal together."
康軒,八下,lesson 6,ocean,n.,海洋,Many people are swimming in the ocean although the water is cold.
康軒,八下,lesson 6,turtle,n.,海龜；龜,The fisherman saw two sea turtles swimming in the ocean.
康軒,八下,lesson 6,point,n.,觀點；論點,I agree on your point about not using plastic tableware.
康軒,八下,lesson 6,perhaps,adv.,也許,The sky is getting dark. Perhaps it will rain soon.
康軒,八下,lesson 6,if,conj.,如果,Rick will stay home if it rains tomorrow.
康軒,八下,lesson 6,take / took action,,採取行動,We must take action if we don’t want the dog to get hurt.
康軒,八下,lesson 6,own,adj.; v.,自己的；擁有,Jerry has his own apartment in Taipei.
康軒,八下,lesson 6,though / although,conj.,雖然,Eric went to school yesterday though / although he was sick.
康軒,八下,lesson 6,carry,v.,攜帶,Gina helped her grandma carry the heavy bag.
康軒,八下,lesson 6,break / broke down,,分解,Plastic bags don’t break down easily.
康軒,八下,lesson 6,correct,adj.; v.,正確的；更正,Tom got eight correct answers on the test.
康軒,八下,lesson 6,feed / fed,v.,餵,Ian feeds the dogs twice a day.
康軒,八下,lesson 6,baby,n.,幼鳥；嬰兒,The birds are feeding their babies in the trees.
康軒,八下,lesson 6,tell / told... from...,,區分⋯⋯與⋯⋯,Ms. Lee can’t tell Paul from his brother Mark.
康軒,八下,lesson 6,jellyfish,n.,水母,You can see a lot of beautiful jellyfish in this lake.
康軒,八下,lesson 6,die,v.,死亡,"Sadly, many people die from Covid- all over the world."
康軒,八下,lesson 6,the last straw,,最後一根稻草,"For Jack, losing his car was bad, but losing his job was the last straw."
康軒,八下,lesson 6,disposable,adj.,用完即丟的；一次性的,Eddie threw away the disposable gloves after he used them.
康軒,八下,lesson 6,environment,n.,環境,Plastic bags are bad for the environment.
康軒,八下,lesson 6,enter,v.,進入；輸入,The police entered the building through the back door.
康軒,八下,lesson 6,no longer,,不再,Mrs. Smith no longer works here.
康軒,八下,lesson 6,instead,adv.,作為替,I ran out of coffee. Would you like a cup of tea instead?
康軒,八下,lesson 6,sincerely,adv.,真誠地,Today more and more fathers sincerely try to become better parents. They start doing housework and taking care of their children.
康軒,九上,lesson 1,subject,n.,學科,Nina’s favorite subjects are science and history.
康軒,九上,lesson 1,topic,n.,主題,I can’t think of another topic for my report.
康軒,九上,lesson 1,hairdryer,n.,吹風機,"After Jean washes her hair, she uses the hairdryer to dry her hair."
康軒,九上,lesson 1,paper,n.,紙,I need a piece of paper to write down your phone number.
康軒,九上,lesson 1,century,n.,世紀,We live in the st century.
康軒,九上,lesson 1,common,adj.,普遍的,It is common for kids to be afraid of the dark.
康軒,九上,lesson 1,area,n.,地區；區域,All areas of this country will have some rain today.
康軒,九上,lesson 1,freeze,v.,凍結；結冰,The lakes here freeze in winter.
康軒,九上,lesson 1,potato,n.,馬鈴薯,Tina made potato salad for dinner tonight.
康軒,九上,lesson 1,stick,n.,枝條,Let’s find some dry sticks to make a fire.
康軒,九上,lesson 1,American,adj.；n.,美國的；美國人,Stephen Curry is an American basketball player. 
康軒,九上,lesson 1,soldier,n.,士兵；軍人,"John wanted to be a soldier, but he became a teacher in the end."
康軒,九上,lesson 1,main,adj.,主要的,We don’t have enough money. That’s our main problem.
康軒,九上,lesson 1,language,n.,語言,I’m not good at learning languages.
